,Image_name,Label,Processed_Text,political_specific_count,political_specific_ratio
753,train0765.jpg,Political,আচ্ছা রাজনীতি করতে হলে কী কী করতে হয়? touch ছযাচড়া গরিতে অনার্স করতে হ্য আর চুরিডাকাতিতে কী মস্টাস কৈরতে হয়? honcho,1,0.047619047619047616
754,train0766.jpg,NonPolitical,আমি ইচ্ছা কইরাই অনলাইন ক্লাস করি নাই. আমার গুষ্টিতে একজনও করে নাই আমার নানার গোষ্ঠতেও করে নাই আমার পাশ্ববর্তী এলাকার কেউ করে নাই আমি অনলাইন ক্লাস কইরা নিজে ফেইল করমু না কি? সামায়,2,0.06060606060606061
755,train0767.jpg,NonPolitical,আলু ভাজি রুটি end periesscoubilnaton,0,0.0
756,train0768.jpg,NonPolitical,হোম কুয়ারেন্টিনে থাকা প্রবাসী বাংলাদেশীঃ সঙ্গ,0,0.0
757,train0769.jpg,Political,পপ্পশ্চিমবঙঙ্গেরলোকশু উন্নয়নেরটান উন্নয়ন army,1,0.25
758,train0770.jpg,Political,জাতিরমরুদণ্ড arafat মিন্ত্রনালয় শিক্কণা,0,0.0
759,train0771.jpg,Political,শেখ হাসিনার সালাম নিন all bangladeshi ষাঁড়স নের শীষ মার্কায় ভোট দিন,3,0.25
760,train0772.jpg,Political,কোথায় টাকা রাখবেন astrology horoscope anandabazar paprika কী ভাবে টাকা রাখলে ধনী হওয়া যায়? কী বলে জ্যোতিষশাস্ত্র? mini পিএম কেয়ার আছে তো!,7,0.3181818181818182
761,train0773.jpg,NonPolitical,গরুর বাজারে লাল রংয়ের গোঞজি পড়ে যাওয়া exist আশ্চর্যগরুগুলো রেগে গেলো কেনো,0,0.0
762,train0774.jpg,NonPolitical,ক্রিকেট বিশ্বকাপ থেকে roshlrlsmemg nifziani হংল্যান্ড যা পেয়েছে ill মিমার রা যা পেয়েছে,2,0.15384615384615385
763,train0775.jpg,Political,amp amanda live পুলিশের সঙ্গে ধস্তাধস্তি উত্তেজনা চাকরিপ্রার্থীদের বিক্ষোভ উত্তাল করুণাময়ী tet agitation westbengal শনগাণয গ? cities কী কিউট নাঃ,10,0.5
764,train0776.jpg,Political,মদনদা শুভেন্দু আবে শোন তোর যে বাপ আছে না আমার সাথে এক টেবিলে বসে মাল খায়,1,0.0625
765,train0777.jpg,NonPolitical,হাসতে দেখো গাইতে দেখো অনককথায় মুখোর আমায়দডখা দেখো না কেউ হাসির শেষে নীরবতা parapet,0,0.0
766,train0778.jpg,NonPolitical,আমারও সিক্স প্যাক অ্যাবস আছে যাতে কেউ নজর দিতে না পারে সেই জন্য ভুঁড়ি দিয়া ঢাইকা রাখি iris,1,0.05555555555555555
767,train0779.jpg,NonPolitical,যখন পরীক্ষার সময় pinch কোন হাসির ঘটনা মনে পড়ে,1,0.1111111111111111
768,train0780.jpg,NonPolitical,মিম দেখলে আমি যেভাবে রিয়াক্ট করি halal memos আমার চেহারা যেমন থাকে,0,0.0
769,train0781.jpg,NonPolitical,ফেব্রুয়ারীমপ্র্যান কি ভাবতাছোস নিজ্ঞভবতেছি tangaila sarcasm nifladrol rangaila sarcasm হাওয়ার ভাবনা নিয়া গাড়িতে উঠছে friday,1,0.06666666666666667
770,train0782.jpg,Political,যখন আপনার ন্যায়ের নাম করে গোথামের গরীব মানুষদের ক্যালানোর শখটি শেষ করার জন্য গোথামের ওয়াকাসরা বন্দুক হাতে তুলে নিয়ে আপনার প্রাসাদ ঘেরাও করে,1,0.043478260869565216
771,train0783.jpg,NonPolitical,যখন লঙ্কায় আগুন লেগেছিল লঙক্কা হনুমান,1,0.16666666666666666
772,train0784.jpg,NonPolitical,late তুমি যদি ভাল হও তাহলে তুমি একঢা গার্লফ্রেন্ড শাবরা আর যদি খারাপ হও অণেকগুলা গার্লফ্রেন্ড শবোঁ sushi kereeeeeeee তুমি তুমি,0,0.0
773,train0785.jpg,NonPolitical,from semifinal র্যাবের প্রতিটা কুকুরের পিছে দৈনিক খাওয়া খরচ টাকা সেমস্টাব কা তোএক বিভাবিকার বাং আমিতো কত্তার থেকেও অধম রে,0,0.0
774,train0786.jpg,NonPolitical,অনেক কষ্টে হাত কেটে ক্রাশ এর নম লেখার পর যখন দেখি নাম ভুল হয়ছে ইজ বারোভাতারি তখন অমি,0,0.0
775,train0787.jpg,NonPolitical,ভাই কি ডেন্টাল ডিপরটমেন্টে পড়েন? আমার দাঁতের ফাকে হম কেন? আটকেথকা মাংস বের করে দিবেন? jail সথময মার শোলাবে,0,0.0
776,train0788.jpg,NonPolitical,বড় কোন দূর্ঘটনা কিংবা হতাশা থেকে পাওয়ার পর এখন আমার প্রথন কজ হচ্ছে নমাজ আদায় কর,1,0.0625
777,train0789.jpg,NonPolitical,যখন আপনার বন্ধু মেয়েদের সামনে আপনার বিচিতে টোকা দেয় আপনি,0,0.0
778,train0790.jpg,NonPolitical,scientists corona virus can survive excessive temperature সারাদিন চুলোর সামনে কাজ করা আমার আম্মু,0,0.0
779,train0791.jpg,NonPolitical,hiftfui fureienrelatiles the বন্ধুদের যা পাইতে দেখিবা শুনি আর আমিয়া পাই! cellars have lairs,0,0.0
780,train0792.jpg,Political,"zeenewsindia com chi বাড়িতে নগদ লক্ষ টাকা! সিবিআইয়ের জালে হালিশহর পুরসভা তৃণমূল চেয়ারম্যান স্যার, এবার কী বলবেন? শর অসম্ভব ধারাবাহিকতা বরজায় রেখে খেলছোদলটী",2,0.08695652173913043
781,train0793.jpg,Political,তৃণমূল যেটা দিয়ে দুর্নীতি ঢাকতে চাইছে দুর্নীতি কুঁচুটে,6,0.75
782,train0794.jpg,NonPolitical,যখন কাওকে গার্ড না পড়েই কাঠের বল দিয়ে ক্রিকেট খেলতে দেখিঃ লোহার মুনু মনেহ্য ienielatg,0,0.0
783,train0795.jpg,NonPolitical,চোখে ঘুম ঘুম ভাব নিয়ে সেহেরি খাচ্ছি,0,0.0
784,train0796.jpg,NonPolitical,মশার বাচ্চা মশা tigre moral keep aware রক্ত না খাইয়া চর্বি খাইতে পারস না???,0,0.0
785,train0797.jpg,NonPolitical,from faizlamikorbi আই লাভ ইউ. faizlami forbid কি বললি তুই শয়তান বয়রি! শুনতেই যখন পাছ নাই তাইলে চড় মারলি কেন,0,0.0
786,train0798.jpg,Political,প্রতিদিন martha chattered পার্থর মল ভরতি মগ ছুঁড়ল জঙ্গি মুসা! পড়ে গেলেন প্রাক্তন মন্ত্রী এসএসকেএম হাসপাতালের চিকিৎসকরা তার শারীরিক পরীক্ষা নিরীক্ষা করেন চুঢে দ? এই ঘটনার আমিনিন্দাকরহি মরুসাকে ধিক্কার জানাচ্ছি দিকে,9,0.2903225806451613
787,train0799.jpg,NonPolitical,আমি এখনো সিলেবাস ধরিও নাই আনরে বন্ধ্র সনজঃ season chandra নাঋনা তোর তো পুরা সিলেবাস শেষ,0,0.0
788,train0800.jpg,NonPolitical,ডাবল সেঞ্চুরির উপর ভ্যাট দিতে হবে সাকিব রিয়াদ ছিন্তা করিস আমরাতো বিবদেশকুরসি কিন্তু না,0,0.0
789,train0801.jpg,NonPolitical,কি গর কিনছো? ষাঁড়ানাবিলদ does এই শ্ন তুমি আমাদের গরুকে বলদীবলবানয আনেক ভাললগে,0,0.0
790,train0802.jpg,Political,যাঁদের কাগজে মুড়িয়ে টাকা নিতে দেখা গিয়েছে তাঁরাই আজ বিজেপির বড় নেতা enrage narmada radar হায় ভগবান কবে এদের শাস্তি হবে এদের অবিলম্বে গ্রেপ্তার করা উচিত ularada দেশে আইনশৃঙ্খলা বলে ভাইপো তুমি এগিয়ে চলো কিছুই রইলো না আর আমরা তোমার সাথে আছি,10,0.23809523809523808
791,train0803.jpg,NonPolitical,"fbxcoumfiazlankorbi faizlemlrorbi আজ আমার এক বান্ধবী আসছে রাতে থাকবে, তুমি আজ ডাইনিং রুমে শোবে fhizlami ঠিক আছে, একটা শর্ত!! আমার বান্ধবী আসলে তুমিও ডাইনিং রুমে শোবে, কেমন? rob কিন্ত",1,0.034482758620689655
792,train0804.jpg,Political,গ্রামবাসীরা ক্ষেপে আগুন হয়ে আছে তাই গ্রামে গ্রামে দিদির দূত হিসাবে যাওয়া থেকে diesis এটা অনেক কম রিস্কের কাজ,7,0.3684210526315789
793,train0805.jpg,Political,গুজবে কান দেবেন না এগুলো শে জুলাই ডিম বিক্রির টাকা,2,0.2
794,train0806.jpg,NonPolitical,বিকাল টা বাজে রোজা রব্জী রোজা আমি raid,0,0.0
795,train0807.jpg,Political,মোদীজি লাখ টাকা দেবে বলেছে এখনও এলো না! টাকা,5,0.5555555555555556
796,train0808.jpg,Political,"কোন আন্দোলন,বিক্ষোভ হওযা বিদ্যমান বাংলাদেশ সরকারঃ mashrli এখন আমার প্রথম কাজ, ইন্টারনেটের সংযোগের সোগা মেরে দেয়া luusumi objet pun",1,0.05263157894736842
797,train0809.jpg,NonPolitical,বাঙালি মানেই. keuamare mairailla শ্যাম্পুর বোতল খালি হওয়ার পরেও তাতে পানি ভরে ঝাঁকিয়ে আরো দিন চালানো,0,0.0
798,train0810.jpg,NonPolitical,চট আগে মানুষ ৎকিনত ভাল ছবি তোলার জন্য lion এখন কিনে ভাব নিতে পেজ খুলতে ব্যাবসা করতে গার্ল ফ্রেন্ড বানাইতে আর নিজেরে ফটোগ্রাফার উপাধি দিতে,0,0.0
799,train0811.jpg,NonPolitical,"সেমিস্টার ফাইনাল, সে তো এক বিভীষিকার নাম বলো সেনমিস্টার সিস্টেমের সুবিধা কি? সুবিধী তো জানি না from sem final কিন্তু বছরে বার বেইজ্জতি ঠিকই হয়",1,0.04
800,train0812.jpg,NonPolitical,heb বাইজা গেরসেগা শালার পোলাপনএর পটকা শেষ হয়না কিন্তু ফুডানি,0,0.0
801,train0813.jpg,Political,দাঁড়ান কমরেড সুখটা ক্ষূণিকের বিপ্লবটা চিরস্থায়ী শ্রমিকদের ইউনিয়ন গড়ে তোলায় iinullie cost ফোঁকাস করুন কিন্তু,1,0.06666666666666667
802,train0814.jpg,NonPolitical,মারা মবাই থাকো সুখথে আগুন জলুক আমার বুকে,1,0.125
803,train0815.jpg,NonPolitical,urraphuraa কম খরচে কিভাবে মেয়ে পটানো যায়? uradhura troll চয়িনী door কিনে pad era,0,0.0
804,train0816.jpg,NonPolitical,নীখেয়েরয়েছি কারণ ফ্রেন্ডলিস্টের আমাকে বিরিয়ানি খাওয়ায় নি,0,0.0
805,train0817.jpg,NonPolitical,"আমাদের প্রত্যেকের জীবনে এমন বন্ধু আছে, যারা আমাদের থেকে আমাদের ফেইসবুক পাসওয়ার্ড এর উপর বেশী নজর রাখে কিছু কিছু",0,0.0
806,train0818.jpg,NonPolitical,"খথস সব মেয়েরা পরী হতে চায় কিন্তু, আজ পর্যন্তকোন ছেলে জ্বীন হতে চায় নি!",0,0.0
807,train0819.jpg,Political,পিসি বাজপেয়ী ভালো আড্বানী খারাপ আডবানী ভালো মোদী খারাপ চোট মোদী ভালো শাহ খারাপ,3,0.21428571428571427
808,train0820.jpg,NonPolitical,গোবর blhcatloll গোবর সবজায়গায়,0,0.0
809,train0821.jpg,Political,meanwhilelna paralleluniverse bengali এখন জেলেও আমাদের সংগঠন মজবুত হচ্ছে জয় মা মাটি মানুষ! জয় বাংলা!,4,0.26666666666666666
810,train0822.jpg,NonPolitical,mom packs biriyani for tiffin বন্ধুবান্ধব fulani আক্রযণ,0,0.0
811,train0823.jpg,NonPolitical,বছরবয়সী আমিযখনঃ পরীক্ষায় ফেইলা কইরা বাসায় রেজাল্টকার্ড নিয়া যাইতাম আমারী বাবাঃ bengal anupamm অনুপম আহো ভাভিজা আহো hug,1,0.05555555555555555
812,train0824.jpg,NonPolitical,"মাঈশা আমার ভবিষ্যৎ বলতো, শুনণি আপনার বিযে হরেনা!",0,0.0
813,train0825.jpg,Political,তারযানে আপনি বলতে চান ভাবিজি পাঁপড় না খেলে বাড়িতে থাকা যাবেনা meme বাংলা বলতে চাইনা বাইনচো বলছি,0,0.0
814,train0826.jpg,NonPolitical,ফেসবুকে প্রেম গুরু হয় পয দিঞ ike aware moirai আর শেষ হয় দিয,0,0.0
815,train0827.jpg,NonPolitical,কীরৌ বীসীয় বেড়াতে যীওযীর সেকেন্ড পর main memos আমিঃ এখন আমারপ্রথনকাজওয়াইফাইপাসওয়ারডচওয়,0,0.0
816,train0828.jpg,Political,temp সামনে পশসয়েত ডোটআসছে মাসিমা আমাকে চিনতে পারড়েন তোচ কেন চিনভপারবো না! টিজিতকতবার দেয়েছিটোকার বাতিল নিতে,1,0.0625
817,train0829.jpg,NonPolitical,alibi rolls kids irollsekbs trolls alibi stab চিকেন শর্ম বীফ শর্মা anushyaishwilmai dolls alibi truly arius alibis trolls axis trolls trot আনুশকা শর্মাৎ! roll,0,0.0
818,train0830.jpg,NonPolitical,ইতিহাস সাহ্মী আছে সুন্দর কিউট মেয়েদের জন্মই হয় akeilgroup কালো ছেলেদের বউ হবার জন্য,0,0.0
819,train0831.jpg,NonPolitical,whoever finishesthe race first gets পরিবেশ বান্ধব গাছ wait গিলয,0,0.0
820,train0832.jpg,NonPolitical,"কিরে ফইন্নি আজকে তেরবউ তার উপর এতা ক্ষেপলো কেন? join আর কইসনা বন্ধু, অর ছবি ফেসবুকে না দিয়া অয়েলেক্স ডট কমে দিয়া দিসিলাম",0,0.0
821,train0833.jpg,Political,ভাবছো এতো? মিমি যাদ নিজের স্বার্থের জন্য ভোটে না দাড়িয়ে থাকে তবে পশ্চিমবঙ্গে tic এর হয়ে ভোটে দাঁড়ালো কেন?,4,0.21052631578947367
822,train0834.jpg,Political,"আব্রাহাম লিংকন বেচে থাকলে গণতন্ত্রের বর্তমান সংজ্ঞা হতো ikeuamare ডেমোক্রেসি ইজ গভর্নমেন্ট অফ দ্যা বালুর ট্রাক, বাই দ্যা বালুর ট্রাক ফর দ্যা বালুর ট্রাক",6,0.25
823,train0835.jpg,NonPolitical,দিয়া ভাত জানু? হাত দিয়া!!! মি তো ভাবছিলাম মুখ দিয়া খাইছ খাইছ,0,0.0
824,train0836.jpg,NonPolitical,আভই আগে এটা বলেনযে ফুডপীন্ডারডেলিভারি আসিছে কমেন্ট করলেইকিআমিকুলহিয়েযীব,1,0.125
825,train0837.jpg,NonPolitical,যখন কুমুদিনীর মেয়ে প্রপজাল রিজেক্ট করে দেয় তখন আমি নিলদ্গ,0,0.0
826,train0838.jpg,NonPolitical,জিএফ এর সাথে ডেইট যখন যাসের ঢাকা সব শেষ হয়ে যায় আর বাবা থকে ঢাকা চই বাবাঃ mamie এতগুলো টাকা গেল কোথায়? গগয়ে,0,0.0
827,train0839.jpg,NonPolitical,key aware mairalla red কত্তদিন পরেযেএকটা হরতাল পাইলামা! খুর ভালগসযেকিন্তু কারণ আর্জেন্টিনার খেলা দেখআরামসেএকটা ঘুম দেয়া যারে move,0,0.0
828,train0840.jpg,NonPolitical,আমি যখন বাড়িতে থাকি! uuccuunncuccrn one way bags fly যখনবাড়ির বাইরে থাকিচ,0,0.0
829,train0841.jpg,NonPolitical,মোশারফ ভাই এতো রয়স হয়ে গেল কিন্তু প্রেমে পড়লাম না আফসোস!! একটী গর্ত খুঁড়ে নাম দে প্রেম চিল্লাস ক্যারে তারপর সেই গর্তে ঝাঁপাযে পড়,0,0.0
830,train0842.jpg,NonPolitical,ওই দেখেন ইনি সেই ব্যক্তি যাকে সব মেয়েদের ফ্রেন্ডলিস্টে পাওয়া যায়,1,0.09090909090909091
831,train0843.jpg,NonPolitical,আজকের শিক্ষার্থী laiiibajjiibi আগামির সন্ত্রাসী!,0,0.0
832,train0844.jpg,NonPolitical,সেকেনডের জন্যে দরজা লাগানোর পরে বাংলাদেশের পরিবারের সদস্য ববা ছোট ভাই,1,0.09090909090909091
833,train0845.jpg,NonPolitical,teacher mai buchan mai but ghareeb tea halal memos front ranchers,0,0.0
834,train0846.jpg,NonPolitical,ওকে day টাংকি কি? টাংকি তে পনি নাই পানি নাই? facebookcom হা day টাং day এরমানে হচ্ছে পনি নাই টাংকিখোলি,1,0.05
835,train0847.jpg,NonPolitical,আক্মুযখন আযাকেযারে বছরবয়সী আমিঃ lily meme দদাআমাকম্ব,0,0.0
836,train0848.jpg,NonPolitical,যখন টয়লেটে কেউ লাইট অফ করে দেয় আলো. আলো আমি কখনো খুঁজে পাবো না,0,0.0
837,train0849.jpg,Political,লোকটা নবান্নে জানতে গিয়েছিলো relies পুলিশের চাকরির জন্য এখন থেকে ক্যানাইন টুথ বাধ্যতামূলক? চারটে,5,0.35714285714285715
838,train0850.jpg,NonPolitical,thefabeyouiakeiiiheithe মসজিদের ইমাম says পহেলা বৈশাখ হিন্দুদের উৎসব jim ill,0,0.0
839,train0851.jpg,NonPolitical,তুমি অনেক ভালো আমার সব পোস্টে like দাও এই নাও একটু খাও siaimmaa আজব তো! আমি খেতে বলছি বলেই খেতে হবে siaimmaa নাকি!,1,0.043478260869565216
840,train0852.jpg,NonPolitical,আজআমার একবান্ধরী আসছে রাতে থাক তুমিআজডাইনিংরুমশোব druntopothik ঠিক আছে কিন্তুএকটা শর্তএআমারবান্ধরী আসলে তূমিও ডাইনিংরুঅশবকমনঃ,1,0.07142857142857142
841,train0853.jpg,Political,sammy এত নোংরামি দেখলে আগেই রাজনীতি ছেড়ে দিতাম মমতা এমন দেরি হয়ে যায়নি এখন যখন জেনেই গেছেন তাহলে সবাইকে একটু স্বস্তি দিন প্লিজা কিছু,6,0.25
842,train0854.jpg,NonPolitical,"স্বাধীনতা দিবসে কোথাও ঘুরতে যেতে চাইলে আম্মু যখন বলে যেখানেই যাস, সঙধ্যার আগে বাসায় যেনো দেখি স্বাধীনতা কোথায়",2,0.1111111111111111
843,train0855.jpg,NonPolitical,বাংলাদেশী নাপিতরা তাদের ভাবে চুল কাটতেবলাহয় bad none আর তারা যেভাবে কাটে,0,0.0
844,train0856.jpg,NonPolitical,আম্মু কিরে দোকানে কত খরচ হইছে? শয়তান বল ঢাকা আমি টাকা শয়তান,0,0.0
845,train0857.jpg,NonPolitical,বিয়ে বাড়িতে জামাইয়ের এদিকে জুতা চুরি করে জুতা চুরি করছে কে কোথায় লুকিয়ে রাখছি বলে চিল্লাতে থাকা ভুলে গিয়ে গিয়ে বসে জামাইয়ের বন্ধুরা থাকা আমি ইজ বারোভাতারি,1,0.037037037037037035
846,train0858.jpg,Political,can আমি সোম বুধ শুক্রতৃণমূলে থাকি আর মঙ্গল বৃহ শনি বিজেপিতে থাকি রবিবার ছুটিতে থাকি,1,0.06666666666666667
847,train0859.jpg,NonPolitical,হসন ঘুম fulani শদচ সুইটি,0,0.0
848,train0860.jpg,NonPolitical,লকতউনকারণে আগজমীরখা প্যাকট বেসন আমি,0,0.0
849,train0861.jpg,NonPolitical,madridista you ক্লাসেট জুনিয়র বয় সিনিযুর আমি,0,0.0
850,train0862.jpg,Political,ডননড election কলকাতা পুরভোটে তৃণমূল প্রার্থীর হয়ে প্রচারে বিজেপি প্রার্থীর স্ত্রী! দাবি করলেন হারবেন স্বামী lepananla lecemeef টুরু লাবা,9,0.47368421052631576
851,train0863.jpg,Political,ফাঁসিদেওয়াতে আবার কুঁচটে একটা ব্রিজ ভেঙে পড়লো! ওখানেও মেট্রোর কাজ চলছিল নাকি!,3,0.25
852,train0864.jpg,NonPolitical,ভাই খাওয়া না কসম পরকেট একদম ফাঁকা আর লাগবে? miss কিছু শীলা আবে কিছু mist,0,0.0
