,Image_name,Label,Processed_Text,political_specific_count,political_specific_ratio
0,train0001.jpg,Political,হরেক রকম চোর দিয়া বানাইছো মেলা পিসি তোমার দরবারে এখন chi এর খেলা,2,0.15384615384615385
1,train0002.jpg,NonPolitical,বর যাত্রী যাওয়ার টাইমে যখব গাড়িতে জায়গা কম পড়ে ছোটরাঃ,1,0.1
2,train0003.jpg,NonPolitical,তুমিকেখা নাবলল বুকে অনেক ব্যখাহেয় ঠিক মত পানি খাও এটা গ্যাস্রিকের ব্যথা,2,0.16666666666666666
3,train0004.jpg,NonPolitical,যখন ভল্লুক এসে পড়ে এবং আপন এবং আপনার রেস্টফরেন্ড দুরজনের কেউই জানেন না কিভাবে গাছে চড়তে হয়,1,0.058823529411764705
4,train0005.jpg,NonPolitical,বন্ধুযখন তার গফকেকাজিন বলে পরিচয় দেয় সম্পর্কবদলে গেল পলকে একটি,0,0.0
5,train0006.jpg,Political,নির্বাচনের দিন এগিয়ে আসছে সীমান্তের প্রতিটি ভারতীয় সেনা এবং দেশবিরোধী জঙঙ্গ any chuckles danger,3,0.21428571428571427
6,train0007.jpg,NonPolitical,oeeije ceeuaar deejay ofeiraii আমীয় একটী পাখি ড্রেস কিনে দিবা gag পাখিরা আবার ড্রেস পড়লো কবে যে তুমি পাখির ড্রেস পড়বা!,2,0.09523809523809523
7,train0008.jpg,Political,তদন্ত না করে পাকিস্তানকে দোষারোপ করাউচিং হয়ানি মোদির আমার বিরোধীতা করো করতে থাকো কিন্তু দেশের বিরোধীতা করোন,3,0.17647058823529413
8,train0009.jpg,NonPolitical,আমরহর্ট কেপ্রশ্ন করলামঃ নভালোবাস মানে কি? আকাইম্মা হরটবললঃ আমার কাজরক্ত পাম্প হুদাইসিলেবাসের বাইরে প্রশ্ন করিস না করা,0,0.0
9,train0010.jpg,Political,আমি আওয়ামীলীগ করি করোনাভাইরাস যখন জানতে পারে,0,0.0
10,train0011.jpg,NonPolitical,teacher সময় শেষ খাতা দেওনা কেন? student স্যার সময়ের চেয়ে জীবনের মূল্য বেশি teacher কি? student সময়ের জন্য লেখতেনা পেরে যাদ ফেইল কার এবং পরে আত্যহত্যা কার তখন? teacher পরবগট,0,0.0
11,train0012.jpg,Political,দাদা পুরানো তালা ভাঙতে হবে সস্তায় কিছু লেই কলকাতা পূলিশে যোগাযোগ করুণ,3,0.25
12,train0013.jpg,NonPolitical,এইচএসসি রেসাল্টের পর যখন তোমার মা রাজুর পরিবর্তে তোমাকে আস্ত ডিম খেতে দেয় elf এঞ hernia,0,0.0
13,train0014.jpg,Political,সূমন আহম্মেদ বঙ্গবন্ধু সেটেলাইট গক্য গৌপিত টকী কেজি,2,0.25
14,train0015.jpg,Political,মিত্রোঁ বাম পন্থীরা রাজনৈতিক কাজকর্মের জন্য কৌটো নাচিয়ে পেয়সা তোলে ভিখারীর মতো কিন্তু আমরা ভিক্ষা করবো না আমরা পিএম কেয়ার ফান্ড খুলবো,6,0.2727272727272727
15,train0016.jpg,NonPolitical,টাংগাইলের শাডি আর চমচয মহেরা জমিদার বড়ি গোপালপুর গুষজমসজিদ,0,0.0
16,train0017.jpg,NonPolitical,cluolautar raja gimlujaj গুম হইবেন? তো নারায়নগঞ্জ যান না ক্যারে? গুম হমু!! বলছিলাম নাকি ভাই?,1,0.06666666666666667
17,train0018.jpg,NonPolitical,saying গরুর মাংস cause strict diet like,0,0.0
18,train0019.jpg,NonPolitical,ডিয়ার পৃথিরী টুদ্য সেটিসদ্যান গোটু ikkeuamare imairaila দ্যা প্রোফাইল সেঞ্চি অ্যান্ডচয়েস জেনারেল মুড়,1,0.07692307692307693
19,train0020.jpg,NonPolitical,rulhustilllaye ereeebeegu সামনে পহেলা বৈশাখ একটা ড্রেসও কেউ গিফট করলো না এতোগুলা পচা,1,0.07692307692307693
20,train0021.jpg,Political,সৌরভ গাঙ্গূলির বিরব্দে অন্যায় হযেছে রোমদের পরণ করতে allies রত ডাক আর আমাব্দর সাগ্ন্যায় হয়েছে!? করমনিক্ষা শাবীবর্লি প্রানীদের,1,0.05555555555555555
21,train0022.jpg,Political,amp amanda ত্রিপুরায় গণতন্ত্রের হত্যা হয়েছে বিপ্লব দেব bipolar deb সরকার মানুষের অধিকার সুরক্ষা দিতে ব্যর্থ তোপ ফিরহাদ হাকিমের tripura firhadhakim পশ্চিমবঙ্গে পঞ্চায়েত ভোটে তো গণতন্ত্র পাগলু ডান্স করছিল!,12,0.41379310344827586
22,train0023.jpg,Political,এই সময়ে পরীক্ষা নলে ছাত্রছাত্রীদের কোরোণা সংকরম হবে খুব সহজেই তারা শারীরিকভাবে অসুস্থ হয়ে যাবে ভারত রাষ্ট্র,3,0.17647058823529413
23,train0024.jpg,NonPolitical,মা ওই যে ইয়ের উপ্রে আছে ওইটা নিয়া এর নিচে রাখা লে আমি strain,0,0.0
24,train0025.jpg,NonPolitical,vajumideti sane let লোডশেডিং আল্লাহর রহমত কাছে আসেন আপনারে আল্লাহুর গজব দেখাই,0,0.0
25,train0026.jpg,Political,দোষী যেই হোকনা কেন ছেড়েকখা বলবন mbphhunokey narmada idea এমন দৃঢ় পদক্ষেপ নেওজন্য থযংকু,2,0.14285714285714285
26,train0027.jpg,NonPolitical,আম্মুর সাথে বাইরে যাওয়া বিদ্যমান আম্মু মিনিট দাঁড়া আমি এখনই রেডি হয়ে আসতেসি মিপর আমি mgjeueingjmemes,0,0.0
27,train0028.jpg,NonPolitical,"ঈঁ আম্মু, বাইরে খেলতে যাই? যাও, কিন্তু টী সুইটার আর টুপিপরে যাবী কারণ বাইবে অনেক শীতয written টা সুইটার?",0,0.0
28,train0030.jpg,NonPolitical,ওরিও বয় রমজান মাসে শয়তান কে বন্দিকরে রাখা হয় ওরও ব্রয় ওরিও রয় তাতে আর উপায় তুই তো নিজেই একটা শয় তান ওরিও বয় কি,0,0.0
29,train0031.jpg,NonPolitical,আমাকে যখন আম্মু প্রথঘবার নাসারি এর ক্লাস রেখে আসে helljmeme,0,0.0
30,train0032.jpg,NonPolitical,এই জানস বায়ারন মিউনিখ তোহ আর চ্যাম্মপিয়ন্স লীগে ভালো খেলতে পারবে না কি বলস? কেন পরবেনী? আরে দেখস নাই জামানি তৌহ ওদের সব ভালো ভালো খেলোয়াড়দের কিনে ফেলসে,0,0.0
31,train0033.jpg,Political,গোটা শিক্ষা দপ্তর জেলে সেটা বড়ো কথানয় বিধায়কপিলটপকা সেঢাড়ো কথানয় eyes পরযযত টেপ্রূটেঘচ্ছে সেঢা বড়া কথা নযয়! তহলবডোকেথা কোনটাঃ ডাইপো নব জোয়ারআনছে,5,0.22727272727272727
32,train0034.jpg,NonPolitical,একই মেয়ের উপর দুজন ক্রাশ খাওয়ার পর বন্ধু যখন তা আমার জন্য ছেড়ে দেয় biiiellii the,0,0.0
33,train0035.jpg,NonPolitical,দোকানদার কে ছিড়া নোট দেওয়ার পর আমি,0,0.0
34,train0036.jpg,Political,"নতুন তৃণমূল আসলে কী? পিসির তৃণমূল হলো পুরোনো তৃণমূল দোলাদি বলেছিলো, ডাগে এরা খেত ডাইপোর তৃণমূল হলো নতুল তৃণমূল কুন্তল বলেছে ডাগেই এখন খাওয়া চলছে.",13,0.52
35,train0037.jpg,NonPolitical,"ক্লোজআপ দিয়ে পাচ বছর যাবং দাঁত ব্রাশ করতেছি দাড়া ছুঁ আজও একটা মেয়ে বললো না! কাছে এসো,কাছে এসৌ marvel মিনিট ব্রী ক্বী ঠট কিমতু",1,0.041666666666666664
36,train0038.jpg,NonPolitical,আমিগতকালপয়েটিককবললাম বাসায়পৌছোকলদিতে eiiiellirell নেয়েটরমভহয়বাসীনাই,0,0.0
37,train0039.jpg,NonPolitical,"তুই সরাদিন চেলপি গররলজফ্রন্ডের লগে নাইচ্চা নাইচত তুলছ ত্রেক এক দিন এক একটা feel করছ, বস্তি মাকা status মারছ খুব ভালা কথা সাহে ফইন্নির ঘরের ফইন্নি আমারে tag মারছ ক্যারে?? তূলছ seriously rift",0,0.0
38,train0040.jpg,Political,কুঁচুটে times এবারআমরাবাপ বেটিতেএকসথে জোরডাতখাবো.,2,0.4
39,train0041.jpg,NonPolitical,inulin said ali baifakitaiitilii bad lliitai lake fallibaii কিরে তুই পড়তে বসছ না কেন? আমিরোজা fare,0,0.0
40,train0042.jpg,Political,আবু ত্বহা মৌহীম্মিদ অদিননঃদিন্যযীবৎ নিভখঁজ oath exactor bangle পরিমনীরসীজানো ধর্ষণনটিক আওয়ামী আওয়ামী,2,0.16666666666666666
41,train0043.jpg,NonPolitical,না চুদে নিব্বি খেতাব পেলাম দিব্বি,0,0.0
42,train0044.jpg,NonPolitical,সমাজ যখন একটি ছেলে ভুল করে,0,0.0
43,train0045.jpg,NonPolitical,everyone মৌমাছি মৌমাছি কোথা যাও নাচি নাচি? মৌমাছি,0,0.0
44,train0046.jpg,NonPolitical,যে ব্যক্তি ব্রিগেড যেয়ে ডিমভাত পায়নি পুরো দিনটা কোন টাকা ইনকাম করিনি ধুমাত্র ডিমভতখববলে তাও পেলাম নঃ আজ তো বৌ খেতে দেবে না যআর বুকোভদিনটওববাকাম যাবণা,1,0.038461538461538464
45,train0047.jpg,NonPolitical,why don knock crush facebook দিট আব্বাজান আমি knock করবনা আমার লজ্জী লাগ,0,0.0
46,train0048.jpg,Political,কুচুটে এটাই আমার প্রিয় গাড়ি,3,0.6
47,train0049.jpg,NonPolitical,ফেরেঞ্চ প্রোডাক্ট বয়কটকরায়আমাকে ধনবাদ জানানোবন্ধু একটুআগ ফ্রেষ্কিস করেঅসঅটি,0,0.0
48,train0050.jpg,NonPolitical,cal feasts জলিল বলোত বংলাদেশের সবচেয়ে জনপ্রিয় মটরসাইকেল কম্পানি কোনটি contest কোম্পানি দেখেননাই প্রাইসব মটরসাইকেলের পেছনে লেখা থাকে,0,0.0
49,train0051.jpg,Political,দেশদ্দরাহী big চুঢে isles মানে জেননলাড নেই আম যুক্তিতেনা পারলেই সামনের লোককে দেশদরোহী বলদেরো দ্রুবেদজী,4,0.26666666666666666
50,train0052.jpg,NonPolitical,neujanareuacha বিশ্বকাপের জন্য একটা পতাকা কিনছিলাম মাগার..চোরে নিয়া গেছে boche zen,0,0.0
51,train0053.jpg,NonPolitical,ভাই দুই কেজি attention দিয়েন তো এতগুলা attention দিয়া কি করবেন আযার একটা বন্ধু আছে যে সবসময় না পারলায কারো ডিপ হতে না পারলাম কারো স্ট্যাটাস হতে বলে ওকে দিব এই নেন গ্রাঘ বেশি আছে than শবশও,2,0.05405405405405406
52,train0054.jpg,NonPolitical,যখন ঢাকা সিটি কলেজ উদ্ভাসে পড়ে ব্র্যাক বিশ্ববিদ্যালয়ে ভতি হও মনে হচ্ছে যেখান থেকে এসেছি সেখানেই আবার ফিরে এলাম তুমি ব্রাংলা,2,0.09523809523809523
53,train0055.jpg,NonPolitical,hey roku আমিষ ডিরেক্ট রিয়ে ভার্সিটিতে প্রেম hey roku কলেজের প্রেম স্কুলের প্রেম,0,0.0
54,train0056.jpg,NonPolitical,vajyimideii sane গরীন্ধীবাত ড! pluvial চচ glad গান্ধী গান্ধী গান্ধী গীন্ধী বাদ,0,0.0
55,train0057.jpg,Political,"একটা ওয়ার্ডে নির্দল প্রার্থী এগিয়েছিলেন ফলে সেখানে দেড় ঘণ্টা ধরে বন্ধগণনা, খোঁজ পাওয়া যাচ্ছে না ইভিএমের! মন্ত্রী ঘনিষ্ঠ এক মহিলা প্রার্থী একটি ওয়ার্ডে হাজার ভোটে এসব কী চলছেমশাই!? গণতনরের অন্নপ্রাশন চলছে!",8,0.25806451612903225
56,train0058.jpg,NonPolitical,যখন বায়োমেট্রিক পাশ না করায় তোমার সিম বন্ধ করে দেয় ত্রেটাতেওরিটেক ইস!,0,0.0
57,train0059.jpg,Political,banglathedailystarnet help bangle thedailystarnet node বর্তমানে বাংলাদেশ বিশ্বে ধান উতপাদনে তৃতীয় প্রধানমন্ত্রী কৃষিবিদ দিবস উপলক্ষে দেওয়া এক বাণীতে প্রধানমন্ত্রী শেখ হাসিনা বলেছেন বর্তমানে টাকা কৌজ চাল কিনে খাওয়া সাপারণ জনগণঃ suffepngfromisuccess,9,0.2903225806451613
58,train0060.jpg,NonPolitical,rickshawala asking for ভাড়া rainy day law baba,0,0.0
59,train0061.jpg,NonPolitical,পরিক্ষারন আনার মোরাহল তম,0,0.0
60,train0062.jpg,Political,breaking news মমতা অভিষেক মেঘালয় থেঁকে ফেরার পর ভাঙন lies,5,0.5
61,train0063.jpg,NonPolitical,"যখন বহু আমার ক্রাশকে পটিয়ে ফেলি,আর ঠিক সেই আনার রেস্ট ফ্রেন্ড এসে বলে, কিরে বেডীবাজ আর কত মাইয়ারে খাইয়া ছাইরা দিবি লে আমি inn nanoid islam diaz করে কোন কুরকমহিদাই হিইলাম অপমত কস্টে মুহুতে",1,0.029411764705882353
62,train0064.jpg,NonPolitical,পানি খেয়ে নাও মেয়েদের ঈদের ছবি তে লাভ রিয়েকট দিতে দিতে ক্লান্ত হয়ে গেছো,0,0.0
63,train0065.jpg,NonPolitical,দোকানদার কি লাগবে? আমি যেটা ব্যাবহার না করার জন্য আপনার জন্ম হইছে দোকানদার reel had,1,0.06666666666666667
64,train0066.jpg,NonPolitical,এই কয়েকদিন পকেটে মোবাইল ভাইব্রেশন করলেও key aware mairaila মনে হয় ভুমিকম্প হইতেছে! চরম বিপাকে আছি,0,0.0
65,train0068.jpg,NonPolitical,from faizlamikorbi okay এই মেয়ে তোমার মোবাইল নাম্বারটা একটু দিবা? একটু চাইছো এইডা কি দিলা? তাই একটু দিলাম faizlami rob,0,0.0
66,train0069.jpg,Political,রবিডবিতন subhaprasanna tamara award রবীন্দ্রনাথ বেঁচে থাকলে নিজের হাতে মমতাকে পুরস্কৃত করতেন শুভাপ্রসন্ন কুচুটে আমার নোবেলটাও ওনাকে দিয়ে দিতাম,4,0.21052631578947367
67,train0070.jpg,NonPolitical,ব্রাজিল ব্দাম মক্সিকো খেলাব সময় bra mix java cirgjaau off off java off java off java off java off মেক্সিকো বনাম পর্তুগাল খেলা হলে maxi off java off java off java off java off java off java off java off java off java off java off java off java স্কৌরবোর্ড স্কোরবোর্ড,0,0.0
68,train0071.jpg,NonPolitical,যখন বাসায় আসা মেহমানের বাচ্চাকে আপনার খাটে শোয়ানো হয় আর সে হিশু করে দেয়,0,0.0
69,train0072.jpg,Political,amp ডানন্দ tmcmla threats বুথে ঢুকে দেখাও ফের বিরোধীদের হুঁশিয়ারি তৃণমূল বিধায়কের ঢেম ঊগিবি ভ্রমস septeleieh ওরে আমাকে দেখেও তোদের শিক্ষা হয়নি! আরকরেহরে শ্রীলংকান দাওয়াই খাওয়ার পরঃ,5,0.18518518518518517
70,train0073.jpg,NonPolitical,"আব্বুর বানানো স্পেশাল রুহ আফজা, ট্যাং অন্যান্য বাঙিরশরবত শরবত. ওরিও বয় ওরিও বয় ওরিও বয়",0,0.0
71,train0074.jpg,NonPolitical,আচ্ছা ভাই আপনি যাকে সবচেয়ে আপন মানুষ ভাবেন সেই মনুষটা কি আপনাকে আপন মানুষ ভাবে,0,0.0
72,train0075.jpg,NonPolitical,মাসেরপ্রেথম সপ্তাহে সেমিস্টার ফাইলাম সে তো এক বিভীষিকার নাহ মাসের শ্রেষ সপ্তাহে,0,0.0
73,train0076.jpg,Political,একটুরদাঁড়ান বিজেপিরগণসঙ্গীত তৈরীকিরছি,0,0.0
74,train0077.jpg,NonPolitical,হালকা বজ্রপাত বিদ্যমান আপনার door ওয়ালা বন্ধুঃ,0,0.0
75,train0078.jpg,NonPolitical,রযান approaching শয়তন বিপদের গন্ধপাচ্ছি ব্রাংলা,0,0.0
76,train0079.jpg,NonPolitical,কেউ আমাদেরে দাবায়ে রাখতে পারবা না,0,0.0
77,train0080.jpg,NonPolitical,নুনু ঝারা দেওয়ার পর touikir প্যান্টের চেইন লাগানোর পর,0,0.0
78,train0081.jpg,Political,এই সোলা জালো বাবা গত সপ্তাহে লটারি জিতেছিল আবার এই সপ্তাহেও জিতেছে তোমার বাবা তৃণমূল করে? ঠিক ধরেছো আমি তো তোমাকে বলিনি তুমি কী করে জানলে!,3,0.11538461538461539
79,train0082.jpg,Political,কে আবার রটাচ্ছে যে এবার মহালয়া যোদির জন্মদিনের দিন পড়েছে বলে meme বাংলা যা মহালয়ার এক যাস পরে আসবে বলেছে দুর্গা,3,0.14285714285714285
80,train0083.jpg,NonPolitical,বাংলাদেশী দালাল মিডিয়া ব্রেকিং নিউজ বন্যীয় ভেসে আসী ভারতীয় হাতি মারা গেছে ভুল চিকিংসা আর কীটনাশক কে দোষারোপ! fake jazz কিন্তু বন্যা কার দোষে হইলো কি পরিমাণ ক্ষয়ক্ষতি হইলো এটা কোন মনিষডবক্কি নহ!,2,0.06060606060606061
81,train0084.jpg,NonPolitical,রাকাত তারাবির নামাজ পড়া নামাজ না পড়ে আড্ডা যারা nepali শা,0,0.0
82,train0085.jpg,NonPolitical,haji take date total hainniuiih বরিশালের দয়া আমার hkiebhi ররিকসায় উঠবেন না নিশ্চিত কোন বরিশাইলা bad ঢমোঁ axis তোরে বাঁশ দিছিল মনেহয় করে লোক কোন,0,0.0
83,train0086.jpg,NonPolitical,howyou duringramalan youhear,0,0.0
84,train0087.jpg,NonPolitical,"paugailbrsarcasnbd luiladolirtdb কিস ডে তে কিস দিবি না কপিলা? তুই ব্লাশ করস না,তোর গব্ধ মুখে",0,0.0
85,train0088.jpg,NonPolitical,অন্যদের অজন you named top taxi raul and can accept top tan badge tor arose khan and can accept vote ecmablbo ealmmirlur wtpaqp talk lunge clinic rhluzmi and can accept creation lid cure acciatu আমার অজন nthiltut বম vulvrearnedatrnleibets euchred been had imam trigram nun vobvleewedlbtoo tanbadyetor sehurruuuuleunttacgrtinas can hula indian car accent ferried fan bare সান miunesikgo you tob run use burn rise clean hahamirisd rang armband দীষ canoe flats came voiivteomebteo bios eirenic waived votive টিত্রয told shit pull সধাঢার chitroshoni encore accept els tote imam accept,0,0.0
86,train0089.jpg,NonPolitical,"তে কোনো বিল্ডিং খুন হলে, দরোয়ান থেকে জিজ্ঞেস করলে, সে সব সময় দুটা উত্তর দিবে সে ঘুমাইতেছিল অথবা সে চা খাইতে গেসিল পর্গ কিছু bad fall",1,0.038461538461538464
87,train0090.jpg,NonPolitical,than nil khan nov ল্কডাউনে আপুদের অবস্থা কি? khan nov evan khan khan air not kirov than চোষা izltov khan nit khan air khan than tan বাচ্চা কোন টা রেশি জ্বালাচ্ছে? নিজের টা না কি শাশুড়ির টা than alto than,0,0.0
88,train0091.jpg,NonPolitical,কিছনুদিন আগে বৃষ্টিহয় নাক্যান ত্রেখন bulb bib বৃষ্টিথামেনা ক্যান,0,0.0
89,train0092.jpg,NonPolitical,weiringmihiite shirt andeattng ran তরকারী,0,0.0
90,train0093.jpg,NonPolitical,আমি চিনি গো চিনি তোযারে ওগো বিদেশিনী বাংলা honcho লে বিদেশিনী কে রে বাড়া তুই চিনিস আযাকে তুই,0,0.0
91,train0095.jpg,NonPolitical,বন্ধু তোর ভাবীরে কল দিয়ে বল odor আয়িবাইকএক্সিডেন্টকরেছিসপিটালেআছি,0,0.0
92,train0096.jpg,NonPolitical,অহ বাংলাদেশ! vida bono botha hollo টাকারীক্যাণ্ডিরমেয়দঠ বছর! কিন্তু টাকার গিগাবাইট ইন্টারনেট ডাটার মেয়াদ মাত্র দিন!,0,0.0
