,Image_name,Label,Processed_Text,political_specific_count,political_specific_ratio
2069,train2099.jpg,Political,সুজস চক্রবর্তাবে গ্রেফতার করে জিঞঞাসাবাচ করা উচি seines দড দধচগওখ শদভড় বেনিফিসিযাবীর র্ষবসী ডড? গেংর ণ্ডাসালদী উচি,1,0.058823529411764705
2070,train2100.jpg,NonPolitical,গ্রূপ স্টাড় কখন যে আড্ডায় পারণত হব tell mime ধরতে পারবেন না mgilloicouj,2,0.15384615384615385
2071,train2101.jpg,Political,wgnangla com কুমতল আমার সবটা দেখেছে ডগবলের গণডে শোলালেন সোমী mini কুন্তলটা ডারি দুষ্টু,1,0.07142857142857142
2072,train2102.jpg,NonPolitical,when your teacher beats you front your crush চ! আমি চিংকার করিয়া কাঁদিতে চাহিয়ী করিতে পারিনি চিৎকার,0,0.0
2073,train2103.jpg,Political,কোনোরকম রাজনৈতিক্যজ্ঞাননা বামপন্থী আন্দোলনের ভিতরে থাকা থাকা মাথামোটা দক্ষিণপন্থীআইটি দক্ষিণপন্থী মনোভাবাপন্ন লোকদের সেলকর্মী সমালোচনা করা বামপন্থীরা,1,0.0625
2074,train2104.jpg,NonPolitical,তোমার জনাদিজতোমাকেএকটাকিস দিতে হবে! liheebi সব সময় ত্রাজোবাজোজনিস চাও কখনো ভালো কিছুও তো চাইতে পারো eitruiikiibil আচ্ছা তাহলে একটা তই ফোন সিক্স দিয়ো আচ্ছশকিস কোথায় নিবে গালেনা ঠেঁটে,2,0.07142857142857142
2075,train2105.jpg,NonPolitical,interviewer were searching for someone dank candidate wicca fora taka basal koto bolt pare interviewer you hired timpani,0,0.0
2076,train2106.jpg,NonPolitical,bhili bail tub,0,0.0
2077,train2107.jpg,NonPolitical,যখন কোনো মেয়ে বলে তুমি তো অনেক সুন্দর কিউট তখন আমিঃ,0,0.0
2078,train2108.jpg,Political,"alnhbijoy মাসুদকে সামলাই,ফটোগ্রাফারঙ সামলাই",1,0.25
2079,train2109.jpg,NonPolitical,শুভ শিক্ষক দিরস স্যোরজি আচ্ছা রেস্টুরেন্টে চল মসা মাছিভাজা খোওয়াব.,0,0.0
2080,train2110.jpg,Political,amp live খবর কলকাতা পূর্ব বর্ধমান hurry জোলার খবর agitation lldayjen gula তারিখ agitation dayan gula তারিখ না এলে এবার আন্দোলনকারীদের বড়সড় হুমকি দিলেন উদয়ন গুহ আন্দলকারী wii ছগলি উদয়য়ন,14,0.4666666666666667
2081,train2111.jpg,NonPolitical,"একটা মেয়ের স্ট্যাটাস উফফণ কি গরম! enuuynuatrauibsun ঝা মব নব নচব না মেয়ের ভাইয়ের কমেন্ট আপু, তাড়াতাড়ি বথ্ররুম থেকে বের হও! নাহলে আম্বমু কে বলে দেবো আবার মোবাইল নিয়ে বাথ্ররুমের ঢুকসো! fake তুমি",2,0.06060606060606061
2082,train2113.jpg,Political,নটক করছেঃ,0,0.0
2083,train2114.jpg,NonPolitical,keuammare imairala জরিনারুটি গুলা সেকসোস? খালাম্মা,0,0.0
2084,train2115.jpg,NonPolitical,admission test নিয়ে পরীক্ষার নামে ট্যুরের আমার সিরিয়াস বন্ধু প্ল্যান করা আমি head,1,0.07692307692307693
2085,train2116.jpg,Political,পিসিমণি টিকিটটা সিরসময়দাওদাও কিরিসীন্যতো লকডাউনে বস্তা বিস্তাচোলদিলাম গরীরলোকেরীত্রোণ মেরে দিলাম তিবুও চাইও ভগাভাগি করেখেতে হয় বুঝলিক wiewiton dailyhunt sure good pity,2,0.09523809523809523
2086,train2117.jpg,NonPolitical,"cbrhfinsis আন্নটি মাংস, দরজা খলেন",0,0.0
2087,train2118.jpg,NonPolitical,কাপলদের জন্য পহেলা বৈশাখ সৌমস্টার ফাইনাল সৈ তোত্রেকবভাকারনাদ সিঙ্গেলদের জন্য ঠলা বৈশাখ,0,0.0
2088,train2119.jpg,NonPolitical,পাইতাছি গরাসাগারিপাইতোই খবরআছে luau কিরে আমিওবখি পাইতাছিল ইনাবাপস,0,0.0
2089,train2120.jpg,NonPolitical,যখন ঢানা ঘণ্টা পাবজি খেলে মোবাইলকে মিনিটের জন্য দেই মোবাইল pochileipostiings আপনার আর দরদ দেখাতে হবেনা বেইমান এর বেইমান রেস্ট,1,0.05
2090,train2121.jpg,Political,নেতাজি কুঁচুটে পেঁয়াজি,2,0.6666666666666666
2091,train2122.jpg,NonPolitical,গরম দিনে পায়খানা থেকে বাইর হওয়ার পর চন্দ্র,0,0.0
2092,train2123.jpg,NonPolitical,ব্যবসায় উদ্যোগ বউ.,0,0.0
2093,train2124.jpg,NonPolitical,বিয়ে করার আগে. চিল্লাস ক্যোরে বিয়ে করার পরে,0,0.0
2094,train2125.jpg,Political,"প্রতি আপনার জায়গায় আমি থাঁকলে মাথায় গুল করতীম আহত পুলিশকর্তাকে বললেন অভিষেক নবালন অভিযানের নামে বর্বরতা, গুন্ডামি ভণ্ডামি হয়েছে দাবি অভিষেকের কী বুঝলেন মিত্তির মশাই? ভাইপো এতদিনে শে জুলাইকে সমর্থন করলো",12,0.3870967741935484
2095,train2126.jpg,NonPolitical,winter here bic winterishere say winter here,0,0.0
2096,train2127.jpg,NonPolitical,নাসারি থেকে শ্রেণী পর্যন্ত পাঠ্যপুস্তক মাধ্যমিক থেকে কলেজ পর্যন্ত পাঠ্যপুস্তক,0,0.0
2097,train2128.jpg,NonPolitical,ফেবুতে পিক আপলোড দেওয়া বিদ্যমানঃ রিলেটিভ সম্প্রদায়ঃ,1,0.14285714285714285
2098,train2129.jpg,NonPolitical,fhizlemi নাচানাচি কইরাও হাইরা গেলাম com faizlamikorbi কেঁদো না সোনা আবার সামনের বছর চেষ্টা কইরো rob rob fhizlami,2,0.1111111111111111
2099,train2130.jpg,Political,পিসির ফাইল খোলার আশায় অপেক্ষারত বিকাশ রঞ্জন ভট্টাচার্য alibi,4,0.4444444444444444
2100,train2131.jpg,NonPolitical,when celebrate new year eve january night that police won harass চ্ছ আব্বাএকটা জিনিস খেয়ালকরলাম একটু চালাকানাহিলে জীবনে টেকাখুব কঠিন,0,0.0
2101,train2132.jpg,NonPolitical,আমর tomipar আমি যেভাবে দেখি! আমার আন্বমু যেভাবে দেখখ! আমারবধধুরাযভাবেদেখে!,0,0.0
2102,train2133.jpg,NonPolitical,তুরে এইবারের পরিক্ষায় না বাবুজি নম্বর পাইতেইহবে আমি পাব কেপ্রথমে ইয়ার্কি মারস?? শুরুকরছিল বাবুজি??,0,0.0
2103,train2134.jpg,Political,bengaliabplivecom রাজ্যে সরকারি চাকরি পেতে গেলে বাংলা ভাষা জানা জরুরি মুখ্যমন্ত্রী রাজ্যে চাকরি কোথায়!? শেষ কবে নিয়োগ হয়েছে? তাছাড়া রাজ্যে চাকরি পেতে বাংলা ভাষা জানা নয় পকেটে লাখ খানেক অনুদান থাকাটাই জরুরী,16,0.5
2104,train2135.jpg,NonPolitical,যখন দেখ বন্ধু ছোটভাইদেরও গালফেন্ড আছে লেঃ আযি halal memos আযার একটা যানুষ হইলো নাহী,0,0.0
2105,train2136.jpg,Political,সারাদিনল্যারেমানসিকশ্রমব্যেয় করেসম্ভাব্যভ্যাকসিন আবিষ্কার করা বরাশিয়ার ডাক্তারেরা ভ্লোদিমির পুতিনি,0,0.0
2106,train2137.jpg,NonPolitical,extraction দেখার পর সবাই knees বাঙালি একটা জিনিসপাইলে চুদা ভোগটার অবস্থা এমন করবোয়েন মাথা ঢুকানো যায়,0,0.0
2107,train2138.jpg,NonPolitical,ধকরলা ভাজি ammo মিম মরাংলা,0,0.0
2108,train2139.jpg,NonPolitical,চুল বড় রাখলে নিজেকে যেমন মনে হয়! barge আসলে যেমন লাগে,0,0.0
2109,train2140.jpg,NonPolitical,ঢাকায় থেকে গ্রামে এসে শুদ্ধ ভাষায় কথা বলা আমার বন্ধু! বকধুর শুদ্ধ ভাষা শুনে বোকাচোদা হয়ে যাওয়া আমি দু দিন মুখে,3,0.14285714285714285
2110,train2141.jpg,NonPolitical,গরুর মাংস আমিশ আম্মুষ বাংলা মিম,0,0.0
2111,train2142.jpg,NonPolitical,ভাইয়া আপনার next সিনেমার শুটিং শুটিং কি বিদেশে হবে?? না ভাইয়া এইবার বিদেশে করবো না! তাহলে বাংলাদেশেই শুটিং করছেন? না এইবার শুটিং ইন্ডিয়াতে করবো!,0,0.0
2112,train2143.jpg,Political,"ঢু banglajhindustantimescom শিক্ষা ফিক্ষা কিছুই হবে না, সব ডকে উঠবে স্কুল বন্ধ নিয়ে বললেন অনুব্রত কেষ্ট দা স্কুল ডকে উঠে গেলে আমি কোথায় জগ নিয়ে ছোঁড়া ছুঁড়ি খেলতে যাবো?",5,0.1724137931034483
2113,train2144.jpg,NonPolitical,মুড tangaila sarcasm সুইং সুইং ইস্যু,0,0.0
2114,train2145.jpg,NonPolitical,সামনের বেথচে বসা বকধুর মাথায় টোকা দেওয়ার পর আমি এবং আমার বন্ধুরা rae ran ran,0,0.0
2115,train2146.jpg,NonPolitical,"যতই ঝগড়া, মারামারি, শত্রুতা থাকুক সড raul দিন শেষে সবাই আমরা বন্ধু walton",2,0.15384615384615385
2116,train2147.jpg,NonPolitical,কাসিজ ফাতেমা lufilladro friday anguilla sarcasibu তুই আর আমি তে একই,0,0.0
2117,train2148.jpg,Political,এতদিন পরে আজ পার্থ বাবু বলছেন উনি ষড়যন্ত্রের শিকার! আপনি কী বলেন উনি কি সত্যিই শিকার!? ঊনি মোটেও শিকার নন ঊনি আসলে অংশিদার,10,0.43478260869565216
2118,train2149.jpg,Political,কংগ্রেস এবং বিজেপি শাসনের মধ্যে তফাৎ কী? বিজেপি শাসনে দাঙ্গাগুলোর রঙিন ছবি পাওয়া যায়,3,0.21428571428571427
2119,train2150.jpg,NonPolitical,প্রেমিকা পুরাতন হয়ে গেলে বোরিং লাগে দাঁডা ani আর বন্ধু নামক হারামী গুলো যত পুরাতন হয় তত ভালো লাগে মিনিট ব্রী ক্লী,1,0.045454545454545456
2120,train2151.jpg,NonPolitical,বাবা আমাগো সবাই জমিদার কয় ক্যান? memos একবার গল্প দিছিলাম ওপারে আমাগো দেশে আমাগে বিশ বিঘা জমি আছে তারপর থেকেই আমাদের জমিদার বইলা অপমানকরে,1,0.041666666666666664
2121,train2152.jpg,Political,"মাথাপিছু আয় বেড়ে ডলার, জিডিপি প্রবৃদ্ধি ছঁ ঢঁ মাথাপিছু আয় ডিতায হালি টাকা",0,0.0
2122,train2153.jpg,Political,বিজয়া সম্মিলনীর মোড়কে পার্থ কাণ্ডের ড্যামেজ কন্ট্রোলে তৃণমূল রাজ্য জুড়ে পাঁচশোর বেশি সভা তযংচাব ভাম্য স্যনে পটনেছড ঊনলমনা নাটমন মনেয়াব মা গং গণডওবিষ বদ লেভম কুচুঢে চুরির আবার ডামেজ কণ্টরোল!? এটা ওই স্যান্ডোর বুকপকেটের মতন ব্যাপার,7,0.19444444444444445
2123,train2154.jpg,NonPolitical,"বযফ্রেন্ডঃ comffaizlamikorbi তুমি আর পাঁচটা মেয়ের চেয়ে আলাদা গারলফ্রেন্ডঃ fhizlamlrorbi অনেক ধন্যবাদ,কিমত তুমি কিভাবে বুঝলোঃ বরয়ফেন্ডঃ তোমার হালকা গোঁফ আছে",0,0.0
2124,train2155.jpg,NonPolitical,"null labia কিরে মামুর বেটা, তুই নাকি প্রেমে পড়লি? ওরে ফইন্নি প্রেমপড়ুমু ক্যারে? আমি তেমাত্র কলেজে পড়ি!",0,0.0
2125,train2156.jpg,NonPolitical,"ইনবক্সে কেউ যখন মেসেজ দিয়ে বলে যে ভাইয়া আমি একটা ইউটিউব চ্যানেল solid আর বলতে হবেনী,বুইঝা ফেলছি খুলছি",0,0.0
2126,train2157.jpg,NonPolitical,bbiibnbnb প্রিয়তমা পরী ছিল ডানা কোটা ছিল না তাই উড়ে চলে গেল পাত্তাই দিল না,0,0.0
2127,train2158.jpg,NonPolitical,"মাতোমার একট্রা কিগুণ আছে? জ্বি, আমি ভালো নাশিদ গাইতে পারি অফগানিস্তানের রাজধানী! আফগানিস্তানের রাজধানী! আফগানিস্তানের রাজধানী mnelaiz com",0,0.0
2128,train2159.jpg,Political,"brigadier lakhwinder singh ladder বিজেপি সরকার এবং যোগীর বিরুদ্ধে পুরনো টুইট প্রকাশ্যে, লিড্ডারের কন্যাকে গেরুয়া brig idler আক্রিমণ items বাবার চিতা জ্বলছে আর চাড্ডি গুলো তার মেয়েকে ছাচ্ছে! এভাবেই এরা সেনার প্রতি শ্রদ্ধা জানায় এরাই আবার লোকজনকে দেশপ্রেম শেখায় ছিঁড়ে",10,0.25
2129,train2160.jpg,NonPolitical,গইবাল বেবি তোমার কোলে মাথারেখে আমার মরে যেতেইচ্ছেকরে faccbookcom সেটীতো বুঝলামশকিন্তু আমিপুলিশকে বলবোকি?,0,0.0
2130,train2161.jpg,Political,কুচুটে করে ঢাকা দিলি যে হলো না!? কালীঘাটে এসে দেখা কর তুই,3,0.25
2131,train2162.jpg,NonPolitical,"যখন আম আনতে গিয়ে দেখন ছালাও গেছে মনডাঅতি বেজার, ইচ্ছা করতেসে লাফদিয়ে কুয়ার মধ্যে পড়ি!",0,0.0
2132,train2163.jpg,NonPolitical,আমারউপরেরেগগে দোষকরলামআমি কুত্তারবাচ্চশুয়োরের আস্মুনিজেরৌগালি বাচ্চীবিলেগালিঞেয়ী দ্যক্যানবুঝতেনা আমারমী পরাআমি,0,0.0
2133,train2164.jpg,NonPolitical,that face you make যখনী রা বেশিঈদী পায়,0,0.0
2134,train2165.jpg,Political,আমি মুখ খুললে সব তৃণমূল নে জেলে যাবে সরকার পড়ে যাবে আমাকে করতোনলে এখন পাশে দাড়াচ্ছেনা সন নাম লেট কেন করছেন তড়াতাড়ি বলে দেন দুর্নীতি বলে আমি শ্মাস মন্তরীর নেতা ভট্টাচার্য মানিক,8,0.25
2135,train2166.jpg,NonPolitical,এই শীতে অন্যরীঃ minus world অমিশ,0,0.0
2136,train2167.jpg,NonPolitical,যখন বন্ধুকে বলি ভাই মেয়েটী মনে হয় তোর দিকেই তাকিয়েছিল! ovolo memos,0,0.0
2137,train2168.jpg,Political,উন্নয়ন যেটা পিসি প্রচার করে কুঢু him যেটা আসলে ঘটেড়ে উন্নয়ন,7,0.6363636363636364
2138,train2169.jpg,Political,ste এখনও মনে করি অনুব্রত বীরভূমের বাঘ দলের জেলী সভাপতির পাশে দাঁড়িযে ফের ফিরহাদ মন্তব্য দচদ পুরদভাব সেমব ভগা মাজযোব মদ্রী নিয যণিয কেব ডচ তিনি এশাও মযাকব যারভূমের বাম ক্রুব্রত্র মময ill fireman anubrata অনুব্রত প্রভাবশালী নন দাবি ফিরহাদের দিলেন কেষ্ট হীন পোস্টারের ব্যাখ্যাও,14,0.3111111111111111
2139,train2170.jpg,NonPolitical,চোস চোষা চোষ চষ মাচো তুমি এখানে ইন্টারভিউ দিতে এসেছো নার্ভাস হবার নেই রিলেকসকৈরো চৌষী মচগষা চোষো চোষাচোষা চোষা চোষাচোসচোষচো স্যার একটা বিডিতেবোনোকি? কিছু,1,0.041666666666666664
2140,train2171.jpg,NonPolitical,পস bbigbnbiee reiiiiliy,0,0.0
2141,train2172.jpg,NonPolitical,হাতের রং এক মুখের আরেক bail fake bail bailiati baiiifaki bail fake bail fall ski haji fake bull মনে হয় ময়দা শেষহয়ে গেছিলো,0,0.0
2142,train2173.jpg,NonPolitical,আম্মু years old সত্যি বল তাহলে মারবোনা আমি সত্যি বলার সেকেন্ড পরে আস্মিমু,0,0.0
2143,train2174.jpg,Political,বছর পূরব পাকিস্তানি শাসন পশূচমিবঙ্গে আরঃকতদিন,0,0.0
2144,train2175.jpg,NonPolitical,সারাজীবন ফ্রিতে কত বাঁশ খাইলাম মাগার পতাকা উড়ানোর জন্য বাঁশই খুইজা পাইনা!,0,0.0
2145,train2176.jpg,Political,দেখতে পাচ্ছো বিনোদ চাকরিপ্রার্থীদের আন্দোলন ভাঙার জন্য ভাইপো কেমন ছকবাজী করছে,4,0.36363636363636365
2146,train2177.jpg,NonPolitical,"যেই হারে গরম পরতেছে, ike dare আমরা যদি ভুট্টা হইতাম তাইলে এতক্ষণে পপকর্ণ হইয়া যাইতাম del",1,0.0625
2147,train2178.jpg,NonPolitical,"জান চলো শপিং করতে বিদেশ যাই lines uradhura troll নীছ ,আরো ছয় মাসের ব্যান দিবে",1,0.06666666666666667
2148,train2179.jpg,NonPolitical,প্রশ্নপত্র রিপিট হবে না ভেবে ike aware mmairaila ইন্ডিয়া টিম আজকেও মোস্তাফিজকে স্টাডি করে আসে নাই!,0,0.0
2149,train2180.jpg,NonPolitical,যৌতুকে পাওয়া মোটরসাইকেন শতেথকা তা নিয়ে স্কুলে আসা ক্লাসটিচারঃ নবেধ যৌতুক,0,0.0
2150,train2181.jpg,Political,"বৃষ্টিহিয়না কেন? কি করায়ায় সেমিস্টার ফাইনাল, সে তো এক বিভীষিকার নাম ন্যাডানম নেঘকেনড়াদি দেখেন",0,0.0
2151,train2182.jpg,NonPolitical,কি ভাবে ফটো তুলার মানুষ আছেনাকি আমার মতন সন্নযাসী হয়ে আছৌ,1,0.09090909090909091
2152,train2183.jpg,Political,bengaliabplivecom মমতা বন্দ্যোপাধ্যায় বিজেপি অক্সিজেন সাপ্লায়ার কংগ্রেসকে করার চেষ্টা করছেন অধীর উচঢে মক ছক ধরে ফেলেছে সিবিআই নাটক আবার গুরু করুন দুর্বল,9,0.4090909090909091
2153,train2184.jpg,Political,এসো নবীন ভয় নাই ছাত্রলীগে সন্দ্রাস নাই শিক্কবো শান্তি প্রগতি,0,0.0
2154,train2185.jpg,NonPolitical,ইদ মদ মমবেছলেম ষর ইদ মঢ কি মুন তাহ্র এনসী,0,0.0
2155,train2186.jpg,Political,hnlnyy নব মুখ্যমন্ত্রীকে সাম্মানিক ডি লিট দিয়েছে কলকাতা বিশ্ববিদ্যালয়ও feu নি ডাশ দেতড ডাবমচ দদয পবত,5,0.3125
2156,train2187.jpg,Political,amp আনন্দ cow smuggling case গরু পাচার মামলায় অনুব্রত মণ্ডলকে ফের সিবআই তলব দেবেন হাজিরা? আবার সমস্যা দেখা দেবে pay odor দুটোতে,8,0.36363636363636365
2157,train2188.jpg,NonPolitical,সেমিস্টার ফাইনল সৈ তো একবভীধিকার নাম ileum serra পাশ নম্বর সেমিস্টার ফাইনালেরসময়,0,0.0
2158,train2189.jpg,Political,ইনি বিনি টাপা টিনি টানা টুনি টাসা পিসির সাথে ভাইপো গেছে সেটিং হবে খাসা,3,0.21428571428571427
2159,train2190.jpg,Political,সঙ্ঘী নিব্বা যখন দেখে যে তৃণমূল থেকে আসা লিবারেলরা দলে বড়ো বড়ো পদ পেয়ে যাচ্ছে অথচ এতদিন ধরে দলের হয়ে কাজ করার পরেও তাকে কেউ পাত্তা দিচ্ছে না,7,0.25
2160,train2191.jpg,Political,হ্যালো জানু এখন রাখি পরে কর্থী হবে ভোক্তা অধিকার সংরক্ষণ ভ্লিগ দেখতেছি,1,0.08333333333333333
2161,train2192.jpg,NonPolitical,তুমি আমাকে কত টুকু ভালোবাসো? আমাকে যতটুকু ভালোবাসো ততটুকু! iiiilehi imiiiiiii time তুমি,0,0.0
2162,train2193.jpg,NonPolitical,প্রথম ছযৌকী খাওয়ীপর? আমিঃ গুম চোমণচোমসোমা কেনো তূমি আইআইতাই!,0,0.0
