,Image_name,Label,Processed_Text,political_specific_count,political_specific_ratio
1402,train1423.jpg,Political,দেশ নেতাজির স্বপ্নের স্বাধীন ভারত এখনও গড়ে ওঠেনি আমরাই ব্ধী নী গড়ব মূর্তি উন্মোচনে শপথ মোদির টি published sachet sengunta দত্রশ posted january pig রেল তেল বিমান খনি সবই তো বেচা হয়ে গেছে এবার কি বেচে স্বপ্নের ভারত গড়া হবে!?,13,0.325
1403,train1424.jpg,NonPolitical,feel মনীষীরা ঠিকহি বলছে উপরওয়ালা যখন দেয় ছপ্পর ফাইড়া দেয় এখন ছপ্পর ফাইড়া হরতাল অবরোধ পোইতেছি ruin সঞব,1,0.05555555555555555
1404,train1425.jpg,NonPolitical,সারাদিন ফেইল করবো বলে মনে মনে পাশ এর চিন্তা করা ছেলে যখন আসোলেই ফেইল করে ডয় শোনবচ তাহলে কি আমরা ভুল পথে এগোলাম?,2,0.08695652173913043
1405,train1426.jpg,Political,abhishek banerjee এক নতুল সূর্যোদয় দেখবে গোয়া তিন দিনের সফরে গিয়ে বললেন অভিষেক বিতবসবদদতা learnt ella তিন দিলের গোঁয়ী সফরে গেলেন সমূলের সবভারতায় সাধারণ সম্পাদক আভমেক বরন্স্যোপাধ্যাম মসনবারই তিনি ওই ব্রাজ্যে পৌছে গিয়েছেন সামনেই সেখানে বিধানসভা নিবাচন তার আগে রাকৌশল ঠিক করতে তীর এই সফরর বরলে মুলে করা হডছরে বুধবার বেশ কয়েকচি !ৎ আমাবদের দুগোর ভাইপো,17,0.30357142857142855
1406,train1427.jpg,NonPolitical,জন স্রকরয় সমযঅনহমিটি লগলকটিখটসিল uinatiulopibiuatonuluiha একটু আগরেইবরি করসিলাম সেন তাই মিষ্টি লগসী huaiqnukuihahullu ওয়াকাহ,0,0.0
1407,train1428.jpg,NonPolitical,everyone university keeps using their fake bengali accent pupa দযচ,1,0.1
1408,train1429.jpg,Political,জাতীয় পাঠ্য বইয়ে নাস্তিকতা ঢুকানোর দায়ে সমস্ত দোম নাস্তিকদের দেওয়া জনগণ জনগণ নাস্তিকঃ এদিকে আওয়ামিলীগঃ ভাগ্যিস আমারে দেখে নাই!,5,0.2631578947368421
1409,train1430.jpg,NonPolitical,sarcasm কই তুমি?? জানিনাতিরে ত্রেখান একজন আরেকজনের মুখ দিয়ে অক্সিজেন দিচ্ছে ওয়েলকাম টু সোল পার্কা লদ,2,0.125
1410,train1431.jpg,Political,আপনি এতদিস কলকাভায় থেরকে বাৎলা শিষেছেন? নগ pay orozco new tat fed repay বাংলাতে আমি শুধূ দুটো ওয়ার্ডই বলতে পারি cred ten cred ueehii red চোর ট্টিনোমূল,1,0.037037037037037035
1411,train1432.jpg,Political,পিসি সরতঅরপ্রতীক heres,2,0.6666666666666666
1412,train1433.jpg,Political,যে গুলো লূকিয়ে রেখেছিলাম সেগুলা মার্কেটে ররহয়ে গ্রেছে lilly,1,0.1111111111111111
1413,train1434.jpg,NonPolitical,চড়টাকি মোরসনরোকিইয়ার্কি? seriously মারসি তুমি তাইলে আজ বেঁচেগেলে তুমি তো জানো আমিইয়ার্কিএকদম পছন্দ্রকৈরিনা,0,0.0
1414,train1435.jpg,NonPolitical,tart থোছেলেকরো ছেলে legal sarcasm পেজের এণডথিন নীলাদ্রী লে মাইয়াঃ ঝারা আমিরাজি,0,0.0
1415,train1436.jpg,NonPolitical,গরমে কুত্তা পানিতে গৈরমে কুত্তা পানিতে,0,0.0
1416,train1437.jpg,NonPolitical,হুজুর আপনে আযাগোরে গান শুনতে দেননা কেন cut dis direct johanna fulani পরন্যন,0,0.0
1417,train1438.jpg,NonPolitical,bloom বণনডুন্তু তোমার প্রিয় ঢব কে? com দেখা যায় mnhlrasss এই প্লেয়ার সেই প্লেয়ার না,0,0.0
1418,train1439.jpg,NonPolitical,স্কুল টায়ী ডযেছে এসেছ টায় falebedridiiil iilall ম্যীতাম আপনি তামার জন্য অপেক্ষাকরবন নাসবাই খরাপ ভাববে রলী meet,0,0.0
1419,train1440.jpg,Political,বর্ষসেরা দালাল দে deities iuchiurte nerves aware চুমন,2,0.25
1420,train1441.jpg,Political,আড্যিচাইএকদিন্যভোহনবাগন ব্রাজল আরইতালিকেহরিয়যবিশ্ব আম্পিয়ন হোক! ill,0,0.0
1421,train1442.jpg,NonPolitical,"key wove moral মানুষ তাদেরকেই পছন্দ করে, ike aware যাদেরকে তারা কখনো পাবে না",0,0.0
1422,train1443.jpg,Political,জিযারে দলে নননা কেরে? আমি জিয়া দেখতে পারিনা darwin ক্ষমতায় এলেই জিয়া কেপ্টেন,4,0.3076923076923077
1423,train1444.jpg,NonPolitical,teacher the sensesare smell hear feel cancer pictures teacher lucan thearpictures bookingcam দঙ ship nissan fulani দন্দঃ book you silly,0,0.0
1424,train1445.jpg,NonPolitical,ত্রেয়নীঞগতি কোখাও খুঁজৌপবেনকোতূমি সৌকায করেচল তূমিরিকশকিরেআমি,0,0.0
1425,train1446.jpg,NonPolitical,আমার মায়ের হাতের রান্না কেনো সেরা anal part,0,0.0
1426,train1447.jpg,NonPolitical,জমাইকেইয়োও?? ব্যাংকেয়াইলনযনিতে comiseutlnall সেতোতেমবডাবিতাংচ ইলিশমছি লোন? কিসের লোন?? সামনেপহেলা বৈশাখতো,0,0.0
1427,train1448.jpg,NonPolitical,দোস্তবলতো গাড়ীকিসে চলে? গাড়ী পেট্রোল যিলচলে ধুরব্যাট আমার গাডীতোরাস্তায় চলে,0,0.0
1428,train1449.jpg,NonPolitical,সূর্য পৃথিবী আমার বাসা ওরিও বয়,0,0.0
1429,train1450.jpg,NonPolitical,when you are having great time with all your cousins and suddenlyone them says চলো গানের কলি খেলি দচদ্রাচ,0,0.0
1430,train1451.jpg,NonPolitical,চাকরির ইন্টারভিয়্যুতে ম্যোনেজার আপনার শিক্ষাগ্রত যোগ্যতা কি স্যার আমি phd passed high phd school এর মান বলেন তো with difficulty,1,0.05
1431,train1452.jpg,Political,তৃণমূল নেতা drone তোলাবাজি আবাস যোজনা পআমফান সিন্ডিকেট,3,0.375
1432,train1453.jpg,NonPolitical,জানি আবার একটি জন্ম আমার কভু ছবে না জানি আবার এমন করে তোমার দেখা পাব না,2,0.125
1433,train1454.jpg,NonPolitical,আব্বু ঈবদর জামা কিনে দিবা না? মুখে বললে হবেনা brae যাওদরখাস্ত লিখে নিয়ে আসো!,0,0.0
1434,train1455.jpg,Political,made রাজনীতি করি না বুঝিও না তরে দিদিকে ভালো লাগে! নিজেকে যতই তুই বুদ্ধিমান ভাবিস না কেন mixed আসলে তোকে বোকা বললে অর্ধেক বলা হবে!,7,0.28
1435,train1456.jpg,NonPolitical,লুকিয়ে রাখা অঙ্কপরীক্ষায় পাওয়া খাত টযখন মাখুঁজেপায় মাআমাকেঃ ditto chowdhuri শোন তোর সাথে কথাআছে roy,1,0.06666666666666667
1436,train1457.jpg,Political,সামনেই পেশচায়েত ডোট আমি আসছি,1,0.2
1437,train1458.jpg,Political,"political poison তোমার যীশু কেক পেষ্টি আমার যীশু প্রায় রোজই দামী চকলেট আধপেটা থেঁকে যায়ী সংগৃহীত তোমার যীশুর নরম বালিশ আমার যীশু চায়ের দোকানে বিছানাজোড়া গিফট, এবেলা ওবেলা শিফটা তোমার যীশু উইশ করে আমার ঘীশু ধুচ্ছে আজও হ্যাপ্পি ক্রিসমাস, এঁটো জলের গ্লাস karachi two and others comments shares like comment share arc all খায়",5,0.09259259259259259
1438,train1459.jpg,NonPolitical,এই বছরের সেরা কর্মচারী গিয়ভতে নিজের ডিম থাকুক বা না থাকুক মীলিকের ডিম যেন নষ্ট নী হ্য,0,0.0
1439,train1460.jpg,NonPolitical,myreauiiuninelamhall যখন পাশের বন্ধু খাতা দেখায় না যখন পাশের বন্ধু খাতা দেখায়,0,0.0
1440,train1461.jpg,NonPolitical,পূজোতে সঙ্গে ঘোরার পাটনার এর জন্য অপেক্ষা করছি! ovolo memos,1,0.1
1441,train1462.jpg,Political,পোস্ট করেছে posted sharechat স্বপ্নে আদেশ পেয়েছি এইবালতিভরেগলেই আচ্ছেদিন আসরে রাজনৈতিকট্রল google play,7,0.5384615384615384
1442,train1463.jpg,Political,আমি দিদির দূত দিদি আমাকে পঠিয়েছেন এরওবাসী পরমত্বাসী,3,0.375
1443,train1464.jpg,NonPolitical,শোন সআমাকে ঠমাস rest নিতে switzerland অরথবা paris যেতে বলছে তো আমরা যাব বলো pizza iilaiibaji আরেকটা doctor এরকাছে যাব nigiub,3,0.14285714285714285
1444,train1465.jpg,NonPolitical,একটিভ স্যাস্টাস বন্ধ করার পর আমার বন্ধুঃ ভাই দেখ তো আমারে এক্টিভ দেখায় নাকি,0,0.0
1445,train1466.jpg,Political,আমার বাবা তৃণমূলের পঞ্চায়েত প্রধান আমার বাবা তোমার পরিবারের কাং জিজ্ঞেস করছিল তোমার বাবা কি করেন?,2,0.125
1446,train1467.jpg,Political,দেখতে পাচ্চোবিনোদঃ iiiiiir দুর্নীতি আড়াল করতে কিডাবে রাম নবমীর মিছিল নিয়ে দুই দল চো উঠেভ,4,0.26666666666666666
1447,train1468.jpg,NonPolitical,টাইম মেশিন দিয়ে অতীতেযাওয়া আভি পডালেখ আবিষ্কারক,0,0.0
1448,train1469.jpg,Political,meanwhile paralleluniverse bengali একদিনও কেউ জেলে দেখা করতে এলো না!,5,0.5
1449,train1470.jpg,NonPolitical,আনরা হতে পারতন malice tag তুঁমি সারাঁদিন ট্রাফিক জ্যত্র দম থঢম্ব,0,0.0
1450,train1471.jpg,Political,প্রতিরক্ষা খাতে খরচ আরও বৃদ্ধি করা হয়েছে এবং শিক্ষা খাতে খরচ কমিয়ে দেওয়া হয়েছে সরকারি ক্ষেত্রে উচ্চবর্ণদের বেশী ফি দিতে হচ্ছে সংখ্যালঘুদের তুলনায়,12,0.5217391304347826
1451,train1472.jpg,Political,পিসি সবাই মিলেমিশে ডাগ করে খাও একা যাবো সেটা হবে না আঁমি যেতে তো মানা করছি না সিনেতা,3,0.16666666666666666
1452,train1473.jpg,Political,কম বাইঞ্চুদের হরাতে দেশটা স্বাধীন কটইরো দিলম! শোখ মুজি,0,0.0
1453,train1474.jpg,NonPolitical,বারোভাতারী তুমিকি কাঁদছো? না চোখ দিয়ে মুতার ট্রাইকরছি,0,0.0
1454,train1475.jpg,NonPolitical,শিক্ষক সবাই সবার হোমওয়ার্ক বের করো আমি উত্তর বলতেছি সবাই মিলাইয়া নেও ব্যাকবেঞ্চার পডিত,0,0.0
1455,train1476.jpg,NonPolitical,kerala কলেছওবাসাদা শুটকিঅথবামুটকি পড়াশোনা এমনজিনিস মারোসবারপুটকি,0,0.0
1456,train1477.jpg,NonPolitical,অন্যরুমে যেভাবে পরীক্ষা হয়! farsi jazz fake whizz icmipap fiiiii bite আর আমাদের রুমে যেভাবে পরীক্ষা হয়!,0,0.0
1457,train1478.jpg,NonPolitical,বাসায় একা থাকলে mohammed his whole nazi party whole night with like comment share others like this যাকরবোভাবি আসলোযাকরি,0,0.0
1458,train1479.jpg,Political,ধর্ষণকাণ্ডে যাব্বজীবন সাজা ঘোষণা করলো আদালত mini আবার বিজেপির মন্ত্রীরা তিরঙ্গা নিয়ে মিছিল করবে,7,0.5
1459,train1480.jpg,Political,ছোটোবেলার শাকচুন্নী শাকচুন্নী now মিম বানানোর চক্করে জেলে যাওযার ইচ্ছা নেই সারফারাজ,3,0.25
1460,train1481.jpg,NonPolitical,যখন দেখ ক্লাস নাইন এর ছেলে আর ক্লাস এর মেয়ে একসাথে হাত ধরে হাটতেসে আমিঃ এই জীবনোকিকরলাম?,0,0.0
1461,train1483.jpg,NonPolitical,animal ম্যানিমেল জলিলসীরীরীত নৌবাইল চার্জ দিলে দেখবী একদিন বাস্ট করবে touiiiii আমি রাতে মৌবাইল চার্জ দেওয়ার আগে ব্যটিরি খুলেরাখি,0,0.0
1462,train1484.jpg,NonPolitical,বেশি সুন্দর হলে দোস্ত দেখ তোর ভাবী! laiirajjib কম সুন্দর হলে দোস্ত দেখ আমার ভাবী! falibaji sahib jemadar,0,0.0
1463,train1485.jpg,Political,একসময়ছিল গণতন্ত্র এখন fakibajl guitar sate গুমতন্ত্র fakibajl jemadar salic,1,0.1
1464,train1486.jpg,NonPolitical,teacher সবাই বেহেস্তে যাইতে চায় braque trout express ostfnshehee teacher কিন্তু কেউ মরতে চায় না,0,0.0
1465,train1487.jpg,Political,আলিপররদ্রয়ার martha chattered নিয়োগ কেলেঙ্কারিতে আরও চাপে পাথ আপিতা মোনালিসার পর এবার মৌমিতা? খারাপভাবছেন কেন মশাই এতো ঘনিষ্ঠের ভাবুন কতো বড়ো মনের মানুষ তালিকা বেড়েই চলছে,10,0.38461538461538464
1466,train1488.jpg,NonPolitical,সকলের যিষ্টি ঝছবি ডন্যযদয খিখঝ,0,0.0
1467,train1489.jpg,NonPolitical,bangle মামা আমি বড় হয়ে প্লে বয় হ্ব কিন্তু তুই তো ঠিকমত খেলাধুলা করিস নে বাবা প্লে বয় হবি কি করে!,0,0.0
1468,train1490.jpg,Political,শিক্ষা মন্ত্রী টুকে পাশ শিল্প টাইম পাস অর্থ মন্ত্রী দিচ্ছে বাঁশ ক্রীড়ামন্ত্রী কারাবাস নগর মন্ত্রা ঘুষ খাস ফোর পাস গুলে দলদাস মুখ্য মন্ত্রা সর্বনাশ বঙ্গবাসীর লন্ডন বাস inuit dailyhunt ape store googlepiey,10,0.3125
1469,train1491.jpg,NonPolitical,যখন ভার্সিটির সিনিয়র বড়ভাইয়ের ক্রাশকে জুনিয়র প্রপোজ করে সিনিয়র বড়ভাইঃ তুই কিন্তু বহুতবড় জায়গায় হাতদিসাস,0,0.0
1470,train1492.jpg,NonPolitical,"wiiebai স্যার, বাসাই তালা মারা এর মানে বুঝলী দায়া? tiiuvdep item কিস্যার? এর মানবাসী বন্ধ স্যার ফাইজলামির faklbai একটা সীমা আছে দায়াতু তো গায়া!",0,0.0
1471,train1493.jpg,Political,বলছি বিধিনিষেধ বড়দিনের আগেই চালু করতে হতো who তবে মদ বেচে এতো কোটি টাকা কোথা থেকে আসতো icel টাকা না এলে লক্ষীভাণ্ডার ভরবে কিসে?,8,0.3333333333333333
1472,train1494.jpg,Political,লোকাল রেন আম্বানি আদানির কিনতে চাওয়া সঙ্গে ডিল করে নেচিজেনস বসে থাকা মোদি,2,0.15384615384615385
1473,train1495.jpg,NonPolitical,সারাদিন রোজা রেখে রাতে আম করা আমার নেককার বন্ধু cheer ishtar glen আমি চোর হইলেও ঈমানদার চুরি,1,0.058823529411764705
1474,train1496.jpg,NonPolitical,বেলায় যখন তোমার বাবা মা তোমার বড় দাদা বা বোনদের পকেট খরচ দিত তোমাকে দিত না achintya ছোট কিন্তু,1,0.05263157894736842
1475,train1497.jpg,Political,সারা বছর দূর্নীতি দূর্নীতি বলে চেঁচিয়ে জনগণ যখন নির্বাচনের সময় টাকার বিনিময়ে নিজের ভোট বিক্রি করে দেয় তখন! inside জনগণঃ .সচোদন নাগরিক! did,5,0.21739130434782608
1476,train1498.jpg,NonPolitical,যখন কোন মেয়ে দিনভোরে খাই খাই করে কন্তু রোগা হওয়ার জন্য ডায়েটকন্ট্রোল করবে বলে ঠিক করে একবারে খায় onoupo memos,1,0.05
1477,train1499.jpg,NonPolitical,ফইন্নিডি যেই হারে ম্যাসেজিং অ্যাপ বন্ধ করতাসে key aware maria কয়দিন পর তোকবুতর দিয়া ম্যাসেজ পাঠান লাগবো key ala,1,0.05263157894736842
1478,train1500.jpg,NonPolitical,যখন পরিক্ষার হলে স্যার তোমার দিকে তাকায় দ! যখন স্যার অন্যদিকে ঘুরে যায়,0,0.0
1479,train1501.jpg,Political,শিক্ষা প্রতিষ্ঠান খুলে দেওয়া হবে শিক্ষার্থী ihushbu,2,0.2857142857142857
1480,train1502.jpg,NonPolitical,পারেনা প্রমানচান? পারলেবলো মেয়ের তেরদবিতায়লাইল ক??? কি চুপ কইরা আছে কন?,0,0.0
1481,train1503.jpg,NonPolitical,late মুরগিডিন দেয় এবং গরু দুধদেয় এমন একজন এরীনানযবলোযেদুইটাএকসাথে দেয়? com etokhushi দৌকানদার kaveri kereeeeeeee,0,0.0
1482,train1504.jpg,NonPolitical,"আযার ঘৃত্যুর পরে খেতে এসে যাংস, নিয়ে ঝগড়া করা আমার বন্ধুরা halal memos লেঃ আযার আত্মা! শুয়োরের বাচ্চী তরা কি কোনো দিন যানুষ হবি নাহ",0,0.0
1483,train1505.jpg,NonPolitical,যখন তূমি পরীক্ষীরী হলে কপি করতে করতে ধরী পডে যাও ছাড়! আই চিন্তা করতাছি,0,0.0
1484,train1506.jpg,NonPolitical,you jaaasss পরীক্ষার আগে আমি সেরাসবার থেকে পরীক্ষার সময় আমতেমন কিছুপোরিনা কোনমতেপাসকেরলেই হেরে,0,0.0
1485,train1507.jpg,NonPolitical,জিন্নাহ উর্দু এবং উদুই হবে পাকিস্তানের একমাত্র রাষ্ট্রভাষা dhaka university nibble ell,0,0.0
1486,train1508.jpg,Political,হায আল্লাহ অববোধ না থামলে আমি পালামু কেমনে,0,0.0
1487,train1509.jpg,NonPolitical,শুনলাম বিশ্বকাপের ওপেনিং সেরেমনিতে civil বলিউর কেউনাই ক্যামনেক্য?,0,0.0
1488,train1510.jpg,NonPolitical,রমজানের পর দায়িত্বে আসা শয়তান! রমজান মাসে শয়তান কে নিয়ে মিমস বানিয়ে মজা নেওয়া আমি!,1,0.06666666666666667
1489,train1511.jpg,Political,দিনের কাজে কাঠগড়ায় তৃণমূল পরিচালিত পঞ্চায়েত house তৃণমূল কংগ্রেস এমন কাজ করতেই পারেনা আমাদের নেত্রী সততার প্রতীক আপনার কথা শুনে মনে পড়লো! পোস্টারটা তো অনেকদিন দেখিনা! দুর্নীতি,8,0.2962962962962963
1490,train1512.jpg,NonPolitical,uradhura troll পাইছি কি করা যায় কিংকরীযায়? কিকরাযয়? timid era ফেইসবুকে একটী স্টেটাস দেয়া দি,0,0.0
1491,train1513.jpg,NonPolitical,ckiijani koitesilam hal আমি বাঙ্গি খাবো না পরিবারের লোকজনঃ খাবি না কেন? একটু খা ভালো লাগবে অনেক মজা খেয়ে দেখ একটু নে খা খা,0,0.0
1492,train1514.jpg,NonPolitical,অসাধারণ একটি ছবি এর অর্থ টা বুঝতে চেষ্টা করুন,0,0.0
1493,train1515.jpg,NonPolitical,আমার ভবিষ্যতের থেকেও এই লোকটার মাথা বেশি চিল্লাস ক্যারে? উজ্জ্বল,0,0.0
1494,train1516.jpg,NonPolitical,"আমি তোমাকে ভালোবাসি তুমি জানো আমি তোমার দুই বছরের সিনিয়র ওকে,আমি আপনাকে ভালোবাসি",0,0.0
1495,train1517.jpg,NonPolitical,সহরিরীপর দুপুরের পর টফতারের পর সকালে ঘুম ভাঙারপর eli চক hengalheats cut,0,0.0
1496,train1518.jpg,Political,election result নিকটতম প্রতিদ্বন্দ্বীর থেকে হাজারের বেশি ভোটে জয়ী তৃণমূলের ফৈয়াজ পুরসভা নির্বাচন না লোকসভা নির্বাচন ধরতে পারবেন না,7,0.3684210526315789
1497,train1519.jpg,Political,যখন আমাদের দেশের তখন আমাদের দেশের সন্তানরা বিদেশে অসহায় প্রধানমত্তরী,2,0.2
